name,age,description
"Mattie Duppler",27,"Coalitions director of House Republican Conference"
"R. David Edelman",29,"Senior Advisor for Internet, Innovation, and Privacy at White House"
"Matthew Fischler",26,"Deputy policy officer for Mayor of Chicago"
"Samantha Olds Frey",27,"Executive director of Illinois Association of Medicaid Health Plans"
"Jay Greenberg",29,"Cofounder of LexShares litigation finance"
"Pieter Gunst",29,"Cofounder of LawGives legal marketplace"
"Taylor Jo Isenberg",26,"VP of Roosevelt Institute"
"Ali Grace Marquart",29,"Partner at Marquart & Small law firm"
"Kelli Newman",29,"Cofounder of Paradigm diversity consulting"
"Nikhil Nirmel",28,"Founder of Lawdingo legal services"
"Daniel Rajaiah",23,"Director of external affairs for Mayor of Cincinnati"
"Helena Ramirez",26,"Eastern coalitions coordinator at LIBRE Initiative"
"Azarias Reda",28,"Chief data officer of Republican National Committee"
"Rahul Rekhi",23,"Advisor to chief medical officer of UK Department of Health"
"James Richards",27,"CEO of Teleborder immigration tech"
"Raffi Williams",26,"Deputy press secretary of Republican National Committee"
"Ali Zaidi",27,"Associate director for Natural Resources, Energy, and Science at White House"
"Marianne Barnes",28,"Master Taster at Woodford Reserve bourbon"
"Laura Borel",26,"Head of Nutrition at Jawbone"
"Ali Bouzari",27,"Cofounder of PILOT R&D culinary science"
"Kosta Dionisopoulos",28,"Founder of Delta Produce"
"Kelvin Fernandez",29,"Executive Chef at La Marina"
"Lisa Fetterman",27,"CEO of Nomiku sous vide cooker"
"Nelly Garcia",27,"Founder of Rocheli Patisserie"
"Cosmo Goss",27,"Chef de Cuisine at The Publican Chicago"
"Vince Griffith",27,"Pastry Chef at The Greenhouse Tavern"
"Alex Kvamme",26,"Founder of Yelp SeatMe reservations"
"Gregory Laketek",29,"Owner of West Loop Salumi"
"Tyler Malek",27,"Head Ice Cream Maker at Salt & Straw"
"Will Malnati",29,"Managing Partner of Toro Boston"
"Apoorva Mehta",28,"Founder of Instacart grocery delivery"
"Jack Mason",27,"Wine Director at Marta restaurant"
"Jonah Miller",27,"Owner of Huertas restaurant"
"Hunter Pond",27,"Owner of East Hampton Sandwich Company"
"Stephanie Prida",29,"Pastry Chef at Manresa"
"Rob Rhinehart",26,"Founder of Soylent meal replacement"
"Kurt Taylor",26,"Founder of Next Glass wine app"
"Fadel Adib",25,"PhD candidate at MIT, wireless signals"
"Baldwin Cunningham",26,"Cofounder of Partnered hiring"
"Paul Doersch",26,"Founder of Kespry drones"
"Taso Du Val",29,"Cofounder of TopTal freelancer network"
"Dmitri Gaskin",19,"CTO of Branch Metrics deep linking"
"Ishaan Gulrajani",20,"Cofounder of Watchsend video messaging"
"Jilliene Helman",28,"Founder of Realty Mogul real estate crowdfunding"
"Nancy Hua",29,"Founder of Apptimize A/B testing"
"Joanna Huey",29,"Cofounder of Casetext legal research"
"Jay Kaplan",29,"Cofounder of Synack crowdsourced security"
"Marcin Kleczynski",25,"Founder of Malwarebytes cybersecurity"
"Andrew Levy",29,"Cofounder of Crittercism app performance"
"Max Lynch",27,"Cofounder of Drifty/Ionic mobile framework"
"Om Marwah",25,"Cognitive scientist at Walmart Labs"
"Vinith Misra",27,"Research staff member at IBM Watson Group"
"Georg Polzer",26,"Cofounder of Teralytics location analytics"
"Kira Radinsky",28,"Cofounder of SalesPredict predictive analytics"
"Vivek Ravisankar",27,"Cofounder of HackerRank developer assessment"
"Mehdi Samadi",29,"Cofounder of Solvvy customer support AI"
"Kyle Vogt",29,"CEO of Cruise Automation self-driving cars"
"Junyu Wang",29,"Cofounder of Wandoujia Android app store"
"Yan Zhu",23,"Privacy engineer at Yahoo"
